{
  "schema": "capsule.upgrade_work_order.v1",
  "orderId": "capsule-upgrade-project-atlas-protocols-2026-07-06",
  "generatedAt": "2026-07-06T16:00:00Z",
  "generatedBy": {
    "system": "project_atlas",
    "mode": "catalog_diff"
  },
  "project": {
    "atlasProjectId": "project-atlas",
    "atlasTitle": "Project Atlas",
    "capsuleProjectId": "project-atlas",
    "repoRoot": ".",
    "visibility": "public"
  },
  "protocol": {
    "protocolId": "capsule.control_plane",
    "name": "Capsule-as-control-plane protocol adoption",
    "currentVersion": "0.2",
    "targetVersion": "0.3",
    "catalogDigest": "sha256:example-catalog-digest",
    "catalogSource": "capsule://protocols/catalog"
  },
  "detection": {
    "status": "outdated",
    "observedAt": "2026-07-06T16:00:00Z",
    "evidence": [
      {
        "kind": "capsule_manifest",
        "ref": ".project/project_manifest.json",
        "summary": "Project records Project Ops Capsule v0.2 metadata."
      },
      {
        "kind": "protocol_catalog",
        "ref": "capsule://protocols/catalog#capsule.control_plane@0.3",
        "summary": "Canonical catalog targets control-plane protocol v0.3."
      }
    ]
  },
  "adoption": {
    "status": "upgrade_order_generated",
    "recordedVersion": "0.2",
    "targetVersion": "0.3",
    "recordedAt": null,
    "evidenceRef": null
  },
  "policy": {
    "writePolicy": "stage_only_until_user_approved",
    "operatorApprovalRequired": true,
    "multiRepoMutationAllowed": false,
    "allowedMutationScopes": [
      "atlas_record",
      "atlas_review_draft",
      "atlas_queue_item",
      "target_project_docs",
      "target_project_schema",
      "target_project_tests",
      "target_project_capsule_metadata"
    ]
  },
  "upgradePlan": {
    "summary": "Stage a target-project upgrade order that adopts the Capsule control-plane protocol without silent repository mutation.",
    "steps": [
      {
        "id": "detect",
        "title": "Confirm current local capsule metadata and catalog target.",
        "owner": "atlas",
        "mutationScope": "atlas_record"
      },
      {
        "id": "review",
        "title": "Ask the operator to approve or defer the target-project upgrade.",
        "owner": "operator",
        "mutationScope": "none"
      },
      {
        "id": "apply-target-project",
        "title": "After approval, update the target project docs, schema, tests, or capsule metadata in that project only.",
        "owner": "target_project_agent",
        "mutationScope": "target_project_docs"
      },
      {
        "id": "record-adoption",
        "title": "Record adopted status only after target-project evidence is attached.",
        "owner": "atlas",
        "mutationScope": "atlas_record"
      }
    ],
    "validation": [
      "Parse the generated upgrade work order JSON.",
      "Run the target project's lightweight docs/schema tests after approval.",
      "Attach adoption evidence before marking adopted."
    ],
    "rollback": "Reject or defer the generated order; do not edit the target repository during detection."
  },
  "atlasActions": {
    "createsQueueItem": true,
    "createsReviewDraft": true,
    "recordsAdoptionStatus": true
  },
  "forbiddenActions": [
    "mutate_other_repository_without_operator_approval",
    "push_or_publish_without_operator_approval",
    "mark_adopted_without_evidence",
    "run_unapproved_target_project_commands",
    "rewrite_capsule_catalog_from_atlas_detection"
  ],
  "notes": [
    "Generated orders are stage-only until an operator approves the target project work.",
    "A generated order is not itself proof of adoption."
  ]
}
